instruction_zh,input_zh
给定一张地图，请找到离您最近的饭店。,地图：一张基于谷歌地图的北京市地图。您的位置标记为A，附近有3家饭店：B，C和D。
编写一个Python脚本，用于筛选电影数据集。筛选要求是根据电影类型和年份。您可以使用任何适当的Python库。,您拥有一个包含以下信息的电影数据集：电影名称、电影类型、电影年份。
选择最佳答案完成下面的句子。,"""昨天我去了_______，结果却发现我忘记带钱包了。""

- 超市
- 公园
- 电影院
- 餐厅"
将一段英文文本翻译成中文。,一篇长达500字的英文科技文章，介绍了一种新型的人工智能技术。
使用已有的数据集，训练一个情感分类模型。,数据集包含不同类型的电影评论。
将以下文本编辑成一份商业广告。,这是一份关于一款新产品的描述，我们希望将其转换成商业广告，吸引更多的消费者。
优化办公室布局，提高员工工作效率和舒适度。,公司MNO的办公室布局需要重新设计，以提高员工的工作效率和舒适性。
请找出由下面这些字母可以组成的所有单词。,"字母：R, E, A, D"
给出三个在下雨天玩的室内游戏。,
请给我一些关于成功生活的建议。,
编写一段回文检测程序，以检测输入的字符串是否是回文，如果是，输出“是回文”，否则，输出“不是回文”。,用户输入了字符串“上海自来水来自海上”。
"在这段文字中找到一个错误的逻辑。然后用一两句话解释一下问题以及正确的逻辑。

段落：学生住宿问题讨论中，很少有人提到彩排问题。显然，如果你是一个彩排专家，那么你肯定会愿意住在离彩排场地更近的地方，这样你就不会错过每一个演练的机会。",
写一篇200字的文章，讨论缺乏睡眠对人们的影响。,越来越多的人在现代社会中面临着睡眠不足的问题。这篇文章将重点关注睡眠不足对身体和精神健康的影响。
根据提示，创造一个有创意的句子。,提示: “一个可爱的老太太在公园里走着时，突然看到地上的一枚硬币。”
基于给定的文本，使用BERT模型预测文本的情感极性。您应该将结果视为一种概率，并输出每种极性可能性的百分比。,"""这部电影真是太棒了！我很喜欢它的剧情和演员表演。我肯定会再看一遍的。"""
给我一份关于运动和饮食健康的建议。,
请描述一则新闻标题，并简要解释它的意义。,标题：“美国国会通过新的经济刺激计划”
请用简短的句子简述下面的概念。,请简述云计算的概念。
请列举您可以想到的三件事情，以帮助您更有效地管理时间。,为了更有效地利用时间，您需要采取什么行动？
写一篇与指定主题相关的文章。,主题：跨界艺术
在300字内，描述你最喜欢的食物，并提供制作方法。,请描述你最喜欢的菜肴，并详细说明如何制作它。
为给定的文本生成一组标签。,关于一部电影的评论集，需要为每个评论生成一组标签。
根据这个数据集，找到最佳的分类器来预测用户点击广告。,数据集：互联网广告的点击数据。
寻找与给定图像相似的图像。,图像：一只黑色的猫
给定此列表，找到其中[最小]和[最大]的数字。,"3, 7, 9, 12, 15, 18"
对于给定的文本，使用关键词提取模型找到其中最重要的关键词。,这是一篇研究论文，讨论了某种新技术的工作原理。你的任务是使用关键词提取模型找到其中最重要的关键词。
将以下翻译成英文：我今天晚上要加班，晚点回家。,我想要写一篇英文邮件，告诉我的外国同事我今天要晚点回家。
根据给定的电影剧本，编写一个电影配乐。,您将获得一份电影剧本，并需要编写一个适合该剧本的配乐。您可以使用任何乐器或声音。
告诉我一些关于成为一名摄影师的建议。,我想学习摄影，但我不知道从哪里开始。你能给我一些关于成为一名优秀摄影师的指导吗？
请撰写一篇由两段组成的记叙文，描述您的最佳旅游经历。,
编写一个短篇小说或故事，内容为不同年龄段的人探险的经历。,我们正在制作一个关于探险的游戏，需要一些关于探险的灵感。
请推荐一个好的餐厅，并说明为什么。,你正在策划一个特别的晚餐。
"请描述以下三个概念，并说明它们之间的区别。
1.机器学习
2.人工智能
3.深度学习",
根据以下要求编辑一篇个人简历。,"您需要更新自己的个人简历，并确保它充分反映了您的技能、工作经验和任职资历。请按以下要求进行编辑：
- 确保个人简历状态最新；
- 详细介绍最近的工作经验和在工作中获得的成就；
- 强调您特有的技能和资质，以区别于其他申请人；
- 简明扼要地描述您的教育背景和专业资质；
- 使用适当的关键词和格式，以让雇主了解您的经历。"
从给定数据中计算出公司某个产品的销售额和销售数量，以及目前的市场份额。,该数据包括了公司所有产品的销售记录，您需要计算出浏览器插件产品的销售额和销售数量，并确定当前市场份额。
从给定的文本数据中提取有关实体的信息。,给定一段英文文本，使用Python提取其中的人名和地名。
给定一个英文名词，请输出它的三个同音异形词。,cat
帮助我生成一篇有关网上购物的文章。,网上购物越来越流行，越来越多的人选择在网上购物。请你撰写一篇网上购物的文章，介绍一些网上购物的好处和坏处。
给定一段文本和一个主题词，请计算该词在文本中出现的频率。,"文本：统计分析是管理决策中非常重要的工具。这本书是统计学的入门书，包含了很多例子和题目，只要您认真学习，就能理解其中所包含的统计学原理。
主题词：统计学。"
生成一个描述某个地方的段落。,旅游景点——紫禁城
翻译一篇500字的英文新闻报道。,新闻报道：人工智能如何影响未来的医疗保健。
构建一个简单的网站，包括主页、关于页面和一个联系页面。确保每个页面都有适当的内容和导航菜单。,
请写一篇有趣的短故事。,今天下午，你感到灵感爆棚，想写一个有趣的短故事。
请撰写一篇论文，描述机器学习技术在金融创新领域的应用。,
根据给出的数据，计算出某地图书馆的借书量统计。,六个月内，有1000本书被借走。
请提供一个常见的烹饪菜谱，并附有最终菜品的照片。,
寻找到一家华盛顿特区的餐厅，在那里你可以品尝到当地美食。,
"请介绍以下三本书中的一本：
1.《1984》
2.《了不起的盖茨比》
3.《百年孤独》",
请告诉助手如何使用Excel表格。包括如何创建新表格、添加行和列、编辑内容和格式、以及保存和打印表格。,
根据给定的图片描述其内容。,
"将下列数字按升序排列：178, 945, 221, 333。",
请写出以下代码中的错误，并进行更正以使其能够正确运行。,"```python
x = 5
y = ""Hello, World!""
print(x + y)
```"
给出一份关于健康饮食的建议清单。,一份健康饮食计划。
如何在自己的Instagram账户上创建一个视觉上吸引人的艺术风格，以吸引更多的关注者和喜欢？,
在指定的城市中预订一辆豪华出租车。,城市：迈阿密
请根据以下信息制定一个旅游行程：目的地，日期，游玩项目，住宿安排。,你正在安排一次旅行，你已经确定了目的地和日期，你还没有计划游玩项目和住宿安排。
在给定的音频文件中剪辑出一个30秒的片段。,"音频文件：Podcast ""乡村风光""
剪辑：开头的故事部分"
创建一个自动化流程，自动从某个文件夹中抽取数据并生成报告。,每个月，公司STU需要从一个固定的文件夹中抽取数据并生成报告。因此，需要一个自动化流程来完成这项任务。
描述接下来的旅行路线以及行程建议。,"目的地：日本东京
时间：四天"
根据给定的场景，编写一段高达300字的描述性文章。,您将获得一个场景，例如一个海滩、一个花园、一艘船等。您需要根据这个场景编写一段高达300字的文章，描述这个场景的感觉、氛围和环境等。
将给定的两个Python列表按照一定的条件连接起来。,"给定两个Python列表，一个包含红色的水果（[""苹果"", ""樱桃"", ""草莓""]），另一个包含黄色的水果（[""香蕉"", ""菠萝"", ""柚子""]）。请编写Python代码以根据名称长度将两个列表连接起来，并将结果作为一个新列表返回。如果长度相同，优先添加红色水果列表中的水果。"
"翻译以下这句话到日语： ""我想学习日语""",
写一则约请朋友一起共度周末的短信。,
Bash 终端中输入一条 Linux 命令，输出简单易懂的解释。,当你在 Linux 下工作时，你需要了解如何使用某个命令。
"请计算以下两个数字的平均值： 4380, 2502。",
为一个给定主题写一篇论文。,你正在为一篇关于当代社会问题的论文做准备。请选出一个主题，例如全球化、民主、家庭关系等，撰写一篇20页的论文。
给定一个短语，将该短语转化为缩写，输出缩写。,短语：自动取款机
基于下列要求，撰写一篇工作简历。,要求：请在两页内撰写一份工作简历，列出过去十年当中的全部工作经历和相应的职责。
找出并更正这个句子中的语法错误。,"""我喜欢糖果它让我感到幸福。"""
根据以下指导，编辑下面的句子中的语法错误并使之正确。,"指导: 把动词形态与主语保持一致，确认名词和动词之间的正确词干一致性。

句子：她每天吃合适的食物，做运动和休息足够。"
根据题目提供的数据写一篇报告，描述这些数据的主要趋势和变化。,数据：公司的销售额和产品类型
"翻译下面的句子成[法语]。
""我今天不想上班。""",
给出一组数字和答案，推断出这组数字正确的排序方式。,"2, 4, 8, 10, 12, 16, 18, 20, 22，答案为：10, 20, 4, 12, 22, 2, 18, 8, 16"
请告诉我，在多少个45分钟的时间段内可以将15个小时转换为整个时间段。,
帮我寻找一家居民区的物业管理服务公司。,
告诉我如何在Photoshop中调整图片的亮度。,我需要编辑一些照片，但不知道该如何在Photoshop中进行亮度调整。
给定一系列数字，请将它们按升序排列。,"23, 45, 1, 67, 34, 7, 9, 101, 23, 56, 78, 4, 89"
请为下面这篇文章写一个标题。,这篇文章讲述了全球气候变化对南极洲企鹅数量的影响。
修改以下句子中的语法错误。,我喜欢跑步，但我的脚很痛。
找出地球上最大的蓝色储水器。,
将以下文本进行编辑，使得文本更具可读性和流畅性。,这是一个长文本段落，涉及较多的专业术语和复杂的逻辑结构。需要考虑如何使得文章更容易理解和阅读。
创建一个包含20张照片的相册，并为每张照片添加文本说明。,照片：夏季度假照片。
请根据给定的体重和身高，计算并输出BMI值。,体重：70kg，身高：1.8m。
给下面这个算术运算添加括号，使表达式的值最大化：8÷2+3×5-1,
查找到2021年4月北京的平均气温。,
依据给定的任务，编写一段 Python 语言的程序代码。,编写一个函数，用于计算平方数的和。函数应该接收一个列表，返回平方数的总和。
请翻译下面的句子到法语：我不会说法语，但能听懂。,
请从以下选项中选择正确的同义词。,"happy:
a. sad
b. joyful
c. angry
d. frightened"
请给我推荐一款适合初学者的Python学习教材，并指出它的优点和缺点。,我已经学了一些编程语言，但从来没有学过Python。我想尽快入手，学会Python开发。
为社交媒体平台设计一套全新的配色方案。,该平台是一款面向年轻一代的社交应用程序。
请列举出有哪些应用程序可以用来编辑图像，以及它们的区别。,"- 我想要用一个编辑工具将我的照片修饰得更美一些。
- 我不想使用Photoshop。"
根据以下的特定要求编辑以下的文章。,这篇文章是一篇关于“如何为大量文件打标签的方法”的教程。请在更改文本之前阅读全文。
为我推荐一些读者可能对其感兴趣的书籍。,我是一名喜欢读书的人，喜欢读小说、历史和科幻类的书籍。我的最喜欢的作家是村上春树。
解释一个公式的含义并给出关键字。,公式：E = mc²
给某个城市写一篇旅游攻略，涵盖当地文化、历史和美食。,墨尔本
请告诉我下一个闰年是哪一年。,无。
请写一篇文章，介绍一个国家的文化。,国家：墨西哥
给出一个可以帮助改善心情的建议。,我最近感到非常压抑和沮丧。
请写一篇介绍摩托车的短文。,摩托车是一种两轮车辆，其操作方式与汽车不同。
根据给定的三个点坐标，使用Python计算出三角形的周长。,"给出坐标点A(1, 2),B(3, 4)和C(5, 6)，请编写Python代码计算三角形ABC的周长。"
阅读一篇科技新闻，用简短的话概括并解释其重要性。,新闻标题：以色列飞天系统计划将其长时间无人机纳入商业用途。
将一句话翻译成另一种语言。,"请将以下英文句子翻译成中文：""I love learning new things!"""
撰写一篇关于体育的博客文章，涵盖这个领域的一个感兴趣的主题。,
制定一份有效的营销策略，帮助一家小型企业提高销售额。,公司PQR是一家小型企业，需要一份有效的营销策略，以提高其销售额。
找出这个人在社交媒体上的用户名。,"张三
- 电子邮件：zhangsan@gmail.com
- Twitter：@zhangsan
- Instagram：zhangsanworld"
在上下文中找到两个相似的事物、概念或事件，将它们结合在一起以描述一个全新的事物或概念。,魔法小子哈利·波特是J·K·罗琳的小说系列的主角，描述了他成长的故事，身为魔法师的他参与了许多惊险刺激的冒险和战斗。
查询哪个国家是2016年奥运会代表的最大国家。输出结果。,
命令模型创作一首诗歌，包含“雪”、“孤独”和“寒冷”的词汇。,
根据所给的单词，使用它们来写一首五言绝句。,"单词：""春风""，""绿树""，""彩蝶""，""溪水""。"
生成一个时长为1分钟的摇滚乐的旋律。,以黑色和白色为主的音乐视频
根据这篇新闻报道，为接下来的一次活动写一篇简短的宣传文案。,官方确认：山东已经取代朝鲜成为中国最穷省份
请推荐一部值得一看的电影。,
找出句子中的五个名词，并为每个名词提供一个同义词。,她的理解是，当粒子被加速器加速成几乎光速时，它们的质量变得更大，也越来越难移动和变化方向。
请告诉我，有多少种颜色可以用来进行微软PowerPoint中的文本高亮？,
请写一封求职信，向 Google 公司申请数据科学的职位。,
给我一个能让我在15分钟内学会一些英语单词的网站或应用程序。,无。
根据提供的代码，编辑程序以实现以下功能。,"代码：

import pandas as pd
df = pd.read_excel('data.xlsx')
print(df.head(10))

功能：将CSV文件""data.csv""导入数据框中，输出头10行数据。"
编写一篇关于动物保护的文章，150字以上。,
在这段文本中，找出并列并具有同等重要性的两个句子。,今天早上，我起床后去洗澡，然后做了早饭。
在给定文本中进行关键词提取。,文本：如果你想养宠物狗，你需要为它提供足够的食物、水、运动和爱。
寻找并列举三个不同国家的首都。,
为我生成一个101到200之间的随机数。,我需要执行一个实验，这个实验需要一个随机数。
表述一个自己想象出的 5 件事的清单，这 5 件事必须足够奇特，能为他人带来快乐。,
请按照你所偏爱的方式，为一个人物角色制定一个背景故事。,
将下列图片中的物体按照颜色分类。,https://www.google.com/search?q=objects+of+different+colors&rlz=1C5CHFA_enUS905US905&source=lnms&tbm=isch&sa=X&ved=0ahUKEwi66OucoZzyAhWIy7wKHREjCmsQ_AUIBigB&biw=1366&bih=657#imgrc=_
基于给定的文本和上下文，构建一个相应的标签或关键词列表。,"以下是一段摘自纽约时报的文章：

华尔街四大银行之一的摩根大通（JPMorgan Chase）已经停止为个人贷款提供服务。该公司表示将重点放在商业贷款和自动贷款上。"
"创建一个包含以下列车班次信息的时刻表：班次名称、发车时间和目的地。

班次名称：G123，D456，T789，K012
发车时间：8:00，12:30，16:45，19:20
目的地：北京，上海，广州，深圳",
请计算圆形直径为10cm的面积。,
找到某个城市的所有公园，包括各自的地址和开放时间，并将它们添加到一个地图上。,成都市
生成一组有关时装秀的设计灵感。,
总结一篇论文的核心观点。,你正在读一篇有关气候变化的研究论文。
"翻译一组西班牙语语句：""Bienvenidos a mi casa.""",
给定一个主题，让机器人帮你写一篇有关该主题的论文。,"主题：""科技和社交媒体"""
推荐一款你最喜欢的游戏，并解释你为什么喜欢它。,
请根据以下文本内容，对文本进行编辑。,"文本：
它只不过是一场昙花一现的表演，不会对整个联赛产生重大影响。"
根据文本生成标题。,一篇名为“心理学研究”文章，内容为“考察疫情期间人们情绪变化的心理学研究”。
将这个句子翻译成英语。,句子：我听说，马拉松比赛中的前几名总是来自于肯尼亚和埃塞俄比亚。
根据下列要求修改文本并让其更通顺。,"""The class was very difficult. The teacher did not communicate the material effectively. Many students did poorly on the exam."""
根据给定的句子创建一个相反的句子。,句子：她喜欢吃披萨。
从给定的短文中生成一个标题。,最近在社交媒体上爆红的一只7个月大的小狗，因为它的笑容被称为“世界上最可爱的狗”。
列出三种市场营销方法。,你正在学习市场营销课程。
描述一下如何锻炼身体的内腰部肌肉。,我听说通过扭动腰部可锻炼内腰部肌肉，你能告诉我具体如何做吗？
使用回归分类器对波士顿住房数据集进行预测。,
通过不超过两个句子，描述如何用一张纸条和一棵树来实现秘密通信。,
升级到最新的操作系统，以获得所有新的功能和更新。,你的电脑运行着已过时的操作系统。
请写一个5个字的短剧剧本。,描写两个人之间的互动。
给出一份某个领域的词汇表。,领域：机器学习。
给定一个单位换算问题，并解决该问题。,把25英里转换成公里。
分析目前市场上最受欢迎的两个智能手机品牌之间的异同。,
将以下文本转换为句子案例格式。,the quick brown fox jumps over the lazy dog
命令模型创作一篇关于夏天的短文，要求使用比喻和形容词来表达夏天的感受。,
使用数据可视化技术生成一个图表，显示五个城市每月的平均温度。,数据可视化是将大量数据以图形形式展示的过程，以帮助人们更好地理解和使用数据。请使用数据可视化技术，创建一个图表，以显示每月在五个城市的平均气温。
"编写一个名为""find_longest_word""的函数，该函数接受一个句子，并返回最长的单词。","请定义一个名为 ""find_longest_word"" 的函数，该函数接受一个句子，并返回最长的单词。"
列举在这个主题下的所有事实。,主题：未来的技术如何改变我们的工作？
对以下文本进行语音合成。,以下是一篇网络评论。
给定两个数字，输出它们的和。,"数字：53, 62"
描述如何使用您公司的软件，并提供一些简单的例子，展示该软件的功能。,您的公司开发了一款新的、高效的办公软件，该软件可以提供一些独特的功能以提高办公效率。您需要向您的同事介绍该软件，并引导他们如何使用它。
"将下面这个问题翻译成德语。
""你可以告诉我在哪里买到最好的巧克力吗？""",
对以下段落进行编辑和校对。,以下是一篇内容丰富但可能有一些拼写和语法错误的文章。
请将句子中的动词强调显示，然后写出一个新的句子，其中强调了新的动词。,沙漠之中存在着各种各样的生命，它们适应了严酷的生存条件。
识别并纠正这段文本中的语法错误。,他的饭太菜，都没有味道的。
列出五种使用人工智能技术的实际案例。,
完成这篇文章的结尾。,在全世界共发行了200多种不同语言的超过10亿册哈利·波特小说，成为了史上最畅销的小说之一。
编写一份简历，以便申请以下工作。,一家外包公司发布了一个招聘广告，寻找一位具有一年以上Web开发经验的程序员。
"将以下字符串转换成小写字母并移除所有空格：""I Love Exobrain"".",
根据所给文章内容，写一篇总结。,阅读一篇介绍人类发展历史的文章。
从给定的图像数据集中训练一个目标检测模型。,数据集包含1000张宠物图片，需要检测其中的狗和猫。
根据以下描述，在给定的时间和地点安排会面。,请安排一次会议，讨论明年的销售计划。会议应在下个星期的周四下午2点到3点之间，在公司总部的会议室举行。
请回答以下问题。,人类最接近月球的一次任务是什么？
根据对话内容，编辑对话以更好地传达情感。,"A：""你知道吗，我今天才意识到自己多么累了。""
B：""你是说你工作太多了吗？还是其他的问题？""
A：""不是工作，而是我决定做一些新的事情，但似乎一切都变得很困难。""
B：""听起来你需要给自己放松一下。也许你可以尝试一些冥想或瑜伽放松一下。"""
"从以下三个数字中找到最大的：23, 45, 77。",
写一个简短的程序，它会输入5个数字并计算它们的平均值。,
根据以下数据，使用matplotlib创建一个条形图。,"以下是四名学生的成绩，其中两名男性和两名女性。
男性：78、82，女性：90、95。"
描述你为成为职业运动员所做的努力和时间。,请描述你为成功成为职业运动员所做的努力和时间，包括训练、比赛、休息等方面的信息。
请提供五部由著名导演执导的电影，并简要介绍它们的故事情节和影响。,我是一个电影爱好者，喜欢欣赏一些经典的电影作品，希望可以看到一些由著名导演执导的电影。
给定一篇文章，根据其中的论据和推理，判断作者的观点。,"主题：教育制度
文章：现代教育制度可能对个体自由发展产生负面影响。教育制度过于强调知识的积累和标准化的评价，而忽视了学生的个性化需求和独立思考能力的培养。此外，教育制度使得人们过分关注学生在考试中的表现，忽视了课外活动的价值。这种教育制度可能具有剥夺性，它会使得学生成为一个机器人式的生物，导致个人自由意志的风险和能力的下降。"
编写一个程序，计算两个矩阵的乘积。,你有两个矩阵，它们的规模分别为mxn和nxp。你需要编写一个程序，计算这两个矩阵的乘积，得到一个mxp的矩阵作为结果。
请编写一个函数，它可以将时间（小时和分钟）转换为秒。,"def time_to_seconds(hours, minutes):
    # TODO: 编写一个函数，将时间（小时和分钟）转换为秒。"
请用简单的语言解释这个概念。,概念：人工智能。
请使用 GPT 模型为一段文本生成一组摘要。,原始文本：https://www.gutenberg.org/files/2701/2701-0.txt
帮我查找一位专家，能够就关于环境问题的话题给我提供咨询和建议。,我对环境问题非常关注，希望能够咨询一个专家，听取他的建议。
通过给定的算法生成一个黑白方格图案。,您需要编写一个算法，可以生成一个任意大小、黑白相间的方格图案。您可以选择使用任何编程语言和图形库，来实现此任务。
请为我定一张周六的餐厅预订。,"城市：旧金山
人数：6人
时间：晚上7点"
给出5个你最喜欢的水果名称，按照字母顺序排列。,
设计一个神经网络，用于分类一个给定的数据集。,你需要设计一个神经网络，它能够对给定的数据集进行分类。请注意，你需要考虑数据集的特性和训练时间等因素。
请编写一个描述如何制作黄油蛋糕的菜谱。,
求8和16的最大公约数和最小公倍数。输出结果。,
请将以下三个单词按照字母表顺序排序。,走廊，隔离，积雪
"说出以下歇后语的答案。

歇后语：十年河东，十年河西。",
请在下列歌词中找到所有带有与“心”有关的单词的歌词，并列出它们。,"但我还是担心
若不是我这样的人盯著你
你是否又会变得冷漠疏离
是否又通宵在工作室里深藏
是否没时间给我们
只会让我去迎合你的心"
