instruction_zh,input_zh
使用Python编写一个程序，扫描文件夹中的所有文件并在控制台中打印出文件名和大小。,"有一个名为""documents""的文件夹，其中包含若干个文档文件。需要编写一个程序，扫描整个文件夹并将文件名和大小输出到控制台。"
为一个婚礼拍摄准备一个拍摄计划，包括时间，地点和需要拍摄的关键时刻。,
"把这段文字翻译成西班牙语。

""他们去了一个漂亮的海滩，在那里他们游泳和晒太阳。""",
请撰写一篇入门级的文章，介绍人工智能的未来前景和应用。,这篇文章将被用于向非专业人士介绍人工智能的概念，并推广人工智能的应用和未来前景。
编写一篇短文章，介绍一个你最喜欢的城市，并讲述它的文化、风景以及人们生活的方式。,一份旅游杂志让你写一篇游记，介绍你最喜欢的城市。
将以下16个数字划分为四组，每组数字的和相等。,您的公司正在开发一个新的财务工具，并计划为客户提供一个特殊的关于该工具的演示。您需要对客户进行4组演示，而每组演示都需要涉及以下16个数字，这些数字代表您公司的历史成本和收入数据。
介绍一种健身运动，这种运动适合哪些人。,我需要一种适合我身体状况的一种新运动方式。
请根据以下要素构建一篇科学研究论文，题目为“影响着色剂对小鼠行为的影响”。,对实验组和对照组小鼠进行着色剂注射后进行行为测试。
根据用户输入的指示，在一份文档中添加所需的表格。,
给我报道过的此刻天气和未来7天的预报。,地点：北京
将一篇短文分成若干段，并为每段添加一个标题。,这是一篇文章，需要为每个段落添加一个标题，并按照逻辑重新组织文章。
给定一张图片，根据其中的主要元素，描述图像的内容并提取相关标签。,
根据给定的新闻，撰写一篇文章摘要。,"以下是一段摘自NYTimes的文章：

在多伦多的一家医院，一名患有糖尿病的患者和一名临终患者接种了一种令人兴奋的新型疫苗。该疫苗可刺激免疫系统产生反应，对抗肿瘤和其他疾病。该试验为期2年，将由加拿大国立研究委员会资助，计划招募120多名患者。"
告诉我在2022年上映的几部科幻电影。,
为一个主题写一篇200字的文章。,请选择任意一个主题，并为它写一篇200字的文章。
描述一下如何制作这道菜。,请介绍如何做冬瓜排骨汤。
在以下列表中选择五种不同（但相关的）产品，每个产品都有以下三个关键指标：总花费、销售总额和毛利率。计算、比较以及解释每个产品的指标。,您的公司正在考虑推出五种不同的产品，并请求您的协助进行比较。为了创建一个有用的报告来帮助他们做出更好的决策，您需要计算、比较和解释每个产品的关键指标。
根据输入的名字和地址，在谷歌地图上标记一个标记点。,"姓名：张三
地址：华山路123号"
根据给定的关键词生成一个相关问题。,"关键词：""人工智能"""
列出当前市场上最流行的5个移动应用程序。,
给定一句问话，请找到其中的主语和谓语，并输出。,句子：当他们去看他们的心理医生时，他们希望获得一些新的建议。
创建一个新的Instagram账户，并设置其主题/目标受众/常见博客文章/常用标签。,
为下一次公司聚会策划一个活动。,公司聚会将在两个月后举行，你需要提供有趣的活动，使所有人都能享受到。
"按照以下格式分类电影：名字、类型、主演。
- 功夫熊猫、动画、杰克·布莱克
- 银河护卫队、科幻、克里斯·普拉特
- 唐人街探案、悬疑、王宝强",
将一段文本转换为所有字母大写。,The quick brown fox jumps over the lazy dog.
写一个3句话的短故事，以“结局恶劣”为结尾。,
更正给定文件中的拼写错误。,论文
重新组织下面的单词，以形成一个有意义的句子。,"""后出的停车场在公园边上新开了。"""
将这个词[ice cream]翻译成[法语]。,
将一个网站从HTTP协议迁移至HTTPS协议。,该网站是一个在线购物商城，需要保证数据的安全和隐私。
编辑下面这个段落的语法和标点，以使其更清晰易懂。,我喜欢阅读食谱的书籍，有时候在下厨房时跟随简单的食谱。我也喜欢在市场上寻找新鲜的食材。
请列举出您拥有的所有数字。,
为以下文本创建一个标题：“如何在家里养宠物狗？”,养宠物狗可以十分有趣，但如果不知道如何管理和照顾的话，就可能会遇到很多挑战。以下是一些需要考虑的因素：室内和室外空间的要求、饮食和营养、健康和疾病预防、适当的锻炼和玩耍等。在这篇文章中，我们将关注如何在家中养宠物狗，并提供一些实用的建议和技巧。
在一个5000条新闻的数据集中，使用分类模型把新闻分成体育、金融、政治、社会等四个类别。,数据集包括5000条新闻，每条新闻包括标题和正文。这些新闻分别属于以下四个类别：体育、金融、政治和社会。您的任务是使用此数据集，创建一个可以将每个新闻分成类别的分类模型。您将获得训练和测试数据集以及每个新闻的真实类别。您需要最小化测试损失作为衡量模型总体性能的指标。
生成一个新的段落，它与所给出的一段文本内容有关。,这是一篇文章的一部分。请在下面生成一段新的内容，与此段相关。
使用Excel和图表功能生成一个销售趋势报告，以显示去年的销售量和今年的销售量的区别。,销售趋势报告是识别企业或组织如何实现目标的重要工具。请利用Excel和其他适当的图表工具，创建一个销售趋势报告，以便更好地了解企业的销售趋势。
编辑以下句子，使其更加简洁。,虽然这部电影很好看，但我认为它太长了，而且有一些情节让人感到无聊。
根据以下描述，给出一份庄园的家具清单。,庄园有四个卧室，两个客厅，一个餐厅，一个书房和一个阳台。卧室里有床、衣柜、书桌和梳妆台。客厅有沙发、咖啡桌、电视以及其他装饰物品。餐厅里有餐桌、椅子和餐具柜。书房里有书架、书桌和椅子。阳台上有一些花和桌椅。
"编辑下面的句子，使其读起来更流畅：

""她在去超市买菜的路上买了瓶牛奶。""",
根据给定的键入测试结果，预测考试成绩。,键入测试结果：88.5、93.2、91.8、87.1、90.6
在给定的数据集中找到模式。,请在以下数据集中找到模式并进行分析：[数据集链接]
写一篇文章，探讨人们对社交媒体的依赖程度。,社交媒体已经在我们日常生活中占据了重要地位，你需要写一篇文章，探讨人们对社交媒体的依赖程度。
将以下一段文字翻译成英文。,你需要把一篇中文文章翻译成英文，这篇文章是关于电视剧的。
根据图片描述，命名图片中的物品。,
"从以下列表中筛选出所有名字以“J”开头的人的名字：[""John"", ""Joseph"", ""Julia"", ""Jenny"", ""David"", ""Daniel""]",这是我的在一个公司的员工列表，我需要获取所有名字以“J”开头的人的名字。
"将以下文本翻译成德语：""我想吃香蕉""",我正在学习德语，希望你能帮我翻译这个简单的句子。
以英语写下一份英文版简历，包括教育背景、工作经历、技能和兴趣爱好。,
创建一个剧本，其中一个角色必须完成某个任务，但在完成任务时遭遇了困难。请提供具体例子。,一位赤手空拳的拳击手必须在冠军争夺战中击败一位巨大而强壮的对手。
根据上下文中的信息，为这个故事创作一个结局。,故事：一个人在海滩上漫步，在沙滩上发现一个瓶子，里面有一封信。
根据给定的照片描述场景和情境。,这张照片中有两个人坐在一个咖啡馆里。他们坐在一张长桌子对面，右边有一个咖啡机。描述这幅画的场景和情境。
请提供有关火车站到机场的交通信息。,你正在巴塞罗那度假，想去参观附近的城市。你已经确定可以在当晚6点之前抵达机场。你需要知道从巴塞罗那火车站到机场可用的交通方式。
写下三个你所拥有的值得收藏的物品。,
根据给定的数据，生成一份销售报表。您需要在报表中包括有关销售额、销售量和利润的信息。,您在一家小型制造公司工作，您负责生成销售报表。您的任务是将最近一年的销售数据转换成表格或图表，并添加对数据的分析和解释。
创建一个提供股票报价的应用程序。,
给定两个数字，计算它们的平均值，结果保留两位小数。,"数字1: 35
数字2: 72.5"
给出以下人的基本信息：年龄、性别、工作和居住地。,李明，男性，30岁，医生，目前在上海工作。
将电影《阿甘正传》中的场景输入翻译为中文。,在这一场景中，阿甘打算离开莫比尔以追寻他的梦想。
请描述一下如何煮蛋。,
找到三条涉及人口普查数据的新闻文章。,
编辑并提高一篇学术论文的可读性，使其易于理解和强调。,您正在帮助一名研究员看一篇27页的经济学论文。
找到一个数字，使其不是素数。,一个素数是指只有1和本身作为因数的正整数。
请创建一个单词查找应用程序的原型。,
根据以下数据，评估两个组之间的差异，并完成适当的假设检验。,您的公司正在研究两种不同的广告形式，以推动其新的会员计划。在对1000个潜在会员进行随机测试后，您需要对两种广告进行比较，以确定哪种广告是最有效的。
将以下一段文章按照时间顺序排列，并进行适当修改修订以提高其可读性。,一篇包含时间线的新闻报道。
根据给定的结构和数据，创建一个数据可视化。,在给定的数据集中，包含了过去一周的交通拥堵情况。请使用Matplotlib或其他数据可视化工具创建一个图表，显示每天的拥堵时间和拥堵级别。
给定一个词语列表，GPT应该输出这些词语的联想词。,词语列表：太阳、沙滩、冰镇饮料、海浪。
请告诉我最好的一种压力缓解方式。,你一周工作六天，每天工作超过10个小时。
请描述一种用于熨烫衬衫的高效方法。,
根据下列指示，编辑一个短信。,"你正在写一封短信，提醒你的朋友过来参加聚会。

原短信如下：

""Hey! Wanted to remind you about the party tonight. It’s at my place at 8. See you then!"""
使用前五个sine值，画出一个sin曲线图。,
编写一份Python代码，用于将CSV文件转换为JSON文件。,"CSV文件：data.csv
JSON文件：output.json"
请将以下句子翻译成法语。,"""今天天气很好，我们可以去公园散步。"""
请推荐一部恐怖电影。,
请列举出三种不同的解决方案，以提高一个电子商务网站的转化率。,
根据给定场景描述生成一个会话。,场景描述：你们一家正在咖啡馆里吃早餐，突然你的孩子开始哭泣。他的玩具掉在地上了，但是他不能够自己去捡起来。
描述一下如何制作番茄炒蛋。,
提供一篇有关人工智能在医疗领域应用的文章。在文章中列出至少3个例子，并简要解释每个例子。,医生和技术人员发现，人工智能正在迅速改变健康保健的方式。在这篇文章中，我们将讨论人工智能在医疗领域所实现的三个应用，这些应用有助于帮助医生诊断疾病、提高药物的普及率以及更好地了解患者的医疗历史。
请告诉我您对即将到来的选举的看法。,无。
请下载并安装一个可以让我更好地管理时间的应用程序。,我希望有一个应用程序，能够让我更好地管理我的时间和日程。
使用下面的跟踪数据，运用适当的数据分析和统计方法，计算出以下指标：最大速度、平均速度和总运动距离。,我们收集了球员在一场曲棍球比赛中的跟踪数据，包括他们在比赛中的位置和速度。您的任务是使用这些数据，计算每个球员的最大速度、平均速度和总运动距离。
列出你最喜欢的一本书及其作者，以及该书的主要情节。,
给我推荐一些适合初学者的网站，让我学习编程。,我是一位初学者，希望从网站上学习编程。
输入一组经纬度坐标，并计算它们之间的距离。,"经纬度坐标：(22.3193, 114.1694) 和 (35.6762, 139.6503)"
请写一篇关于“汽车安全”问题，文章要包含一些关键事实。,
请按照给定的标准格式更新以下生日列表。,"姓名：李华
生日：1990年1月1日
姓名：张三
生日：1987年3月4日
姓名：王五
生日：1995年12月31日"
给出一个情境，要求GPT模型使用60个字以内要表达一句感言，可以是关于当前状况的，也可以是关于个人成长的。,你刚刚完成了某个举世闻名的长期项目并交付个人总结。现在，你正在等待反馈，同时想回顾一下自己所取得的成就。
请为以下句子提供正确的标点符号。,句子：昨天我没有吃饭也没吃午餐只吃了晚饭
列出电影《阿凡达》的三个主角。,你正在和朋友聊天，谈到你最喜欢的科幻电影是《阿凡达》。
请生成一条关于环保的信息。,据联合国环境规划署的数据，人们每年会向海洋中排放800万吨的垃圾。这些垃圾对环境和生物多样性产生广泛的负面影响。
找到这个城市的经度和纬度。,伦敦，英国。
使用给定的语法规则和词汇表，生成一个包含10个句子的随机故事。,语法规则和词汇表见参考资料。
使用以下词汇创作一个故事。,你需要用四个给定的词汇创作一个有趣的故事。这四个词汇分别是：太阳、钥匙、音乐、椅子。
给定一段文本，将其中所有的人名标注出来。,文本：下周，刘备和孙权将会在南京见面商讨政治合作事宜。
对给定的文本进行翻译，将其中的中文翻译为英文。,文本：最美是秋天的傍晚，一声鹅啼过后，林间四处弥漫着暖色的光影，静谧而美好。
请给我五个你最喜欢的书名。,
创建一个电子邮件署名，包括您的名字、联系电话和公司名称。,您将在下一个应聘阶段之前联系提供的雇主。
写一封感谢信，感谢你的导师为你所做的一切。,作为你硕士论文的指导老师，你的导师花费了很多时间和精力来帮助你。
请为这个产品设计一个广告语。,这个产品是一个手机应用程序，可以帮助人们更好地管理日常工作和生活中的任务。
为这个主题撰写一篇500字的论文。,主题：环境保护。
找到一个与特定地点相关的历史事件，并将事件的名称和日期发送给我。,地点：北京
给定一个英文单词，并列出与其相关的同义词和反义词。,单词：extraordinary
请为我找到一篇介绍机器学习应用的文章。,
请设计一个聊天机器人，可以回答一般性的问题。,无。
对这篇文章进行编辑和批注，以改善其逻辑流和读者体验。,文章主题：全球气候变化。
用5个不同的词语描述美丽。,"你需要为你的诗歌作业写一篇关于""美丽""的短文。"
按字母顺序排列下面的单词。,葡萄酒、牛排、蛋糕、三明治、汉堡
写一篇短文，表达你对环保的看法，包括一些实际行动建议。,
提供10个最佳电视剧的列表。,
从以下数字中选择一个随机的整数。,2，5，8，16，22，27，36，48，50，55
为一个电影制作一份 IMDb 电影排行榜的条目。,该电影讲述了一位年轻女孩的生活故事，她在奋力追求自己的目标时，经历了许多挫折和困难。影片运用优美的视觉效果和音乐，情感丰富而动人。它成功地塑造了一个有关家庭、成长和内心努力的故事，向观众传递了鼓舞人心的积极能量和人生智慧。演员阵容也非常强大，包括许多备受尊敬的明星。这部电影目前在IMDb电影排行榜中排名前20。
请编写一个简单的程序，以解决以下问题。,请编写一个程序，用于计算任意两个数字之间的平均数。
请列出十个身体部位，并列出一种运动或动作，可锻炼该部位。,身体部位：手臂、背部、腹肌、大腿、小腿、胸部、肩膀、臀部、腰部、手腕。
计算下面两个数字的乘积。,"9,084 x 6"
请用三个词概括新冠病毒的流行病学特征。,新冠病毒起源于中国武汉市，在全球范围内迅速传播。
列出你最喜欢的5个书籍，并在每本书旁边写下它的主题。,
"根据以下信息，创建一份名单，名单包括姓名、年龄、血型、家庭地址和电话号码。

姓名：张三、李四、王五、赵六
年龄：23，31，29，26
血型：A，B，O，AB
家庭地址：北京市丰台区，北京市朝阳区，北京市海淀区，北京市东城区
电话号码：133-1256-7890，138-4521-7865，155-6983-4321，189-8765-1234",
根据以下描述，编辑文本。,这份报告看起来有点混乱，需要重新编辑一下。
对这个字符串分词，并把分词结果输出。,"字符串：
""这是一个有点复杂的字符串。"""
请编写一篇有关编程的博客文章。,这篇文章应该是关于为什么学习编程很重要的。
请从给定的文件夹中，选择包含最多图片的子文件夹。,您有一个目录，其中包含多个子目录，每个子目录都包含许多图像文件。请编写一个程序，可以选择包含最多图像文件的子目录。
为以下句子提供两个拓展的简洁说法。,"""能请你教我如何使用Photoshop吗？"""
使用给定材料，制作一批蜡烛。,你有一些蜂蜡、棕榈蜡和香料。
请写一篇至少200字的文章，分享一个你最近吸引你注意力的电影或电视剧的感受。,
将以下列表按字母顺序排列，并在末尾将其反转。,"- apple
- orange
- banana
- strawberry
- kiwi"
写一个开场白，介绍你最好的朋友。,你的朋友是一个非常擅长运动、尤其是篮球的人。他/她还爱好音乐，并且是一个非常好的吉他手。
确定一个日期和时间，在该时间您可以与我进行视频通话。,
写一篇推销信，向潜在客户介绍一种新产品。,这个产品是一种柔性的塑料材料，适用于各种用途。
请撰写一篇300字的博客文章，讨论如何有效地学习一门新语言。,
让GPT模型为一个具体的商业产品（如汽车或手机）撰写一篇不少于8句话的广告。,新iPhone XS已经上市。
将下列电影的演员名单按照字母顺序排序。,https://www.imdb.com/title/tt1375666/fullcredits
编写一篇关于技术更新的时事评论。,请您写一篇关于新技术的时事评论，重点关注当前市场中的热门技术趋势。
记录您最近一次的旅行经历。,
给出一个包含十二个月份的列表，编写一个程序，找到其中的第七个月。,"[""一月"", ""二月"", ""三月"", ""四月"", ""五月"", ""六月"", ""七月"", ""八月"", ""九月"", ""十月"", ""十一月"", ""十二月""]"
对给定的文本进行情感分析。,"文本：""这家餐厅的食物很不错。"""
"将以下一段长句进行拆分，每行一个词，使其更容易读懂：
""Despite the negative reception from critics, the film still managed to gross over $100 million at the box office.""",
为一个15岁的孩子制定一份适合的学习计划，包括每天的学习时间和科目安排。,这个孩子读初中，目前在学习语文、数学、英语、历史、地理和物理。
写一篇500字的文章，内容是如何在家里保持健康的生活方式。,假设你在家工作和学习，你需要找出一些方法来保持身体和心理健康。这篇文章应该为那些想要扩展他们的健康知识，以便可以保持活跃并减少焦虑和压力的人们。
生成一条关于人工智能的简短定义。,无。
给定两个数，计算它们的差。,"数值: 56, 32"
为给定的图片生成一个描述。,一张照片，上面是一家人在厨房里制作披萨。
向我介绍一种你喜欢的菜肴，包括其中的配料和食谱。,
请将这篇文章中的所有段落重新排序。,
为我提供关于标准普尔500指数的最新数据和分析报告。,我是一位股票投资者，我希望能够快速获得关于标准普尔500指数的最新数据和分析报告，以便做出更明智的投资决策。
用一句话总结以下诗歌的主题。,但愿人长久，千里共婵娟。
编写一份简历以获取营销助理的职位。,您正在寻找一份营销助理的工作。您应该编写一份专业、有吸引力的简历来吸引潜在的雇主和面试官。你可以从你的过去的经历中挑选出信息，以便更好地展示你的技能和能力。
给定一个文本，输出其中的所有名词短语。,约翰在货车上找到了他的钱包。
在指定的日期和时间向指定人员发送电子邮件。,"请在明天下午4点钟向""张三""发送一封邮件，内容为""晚饭在哪里""。"
请给我列出五个与数学相关的名词。,
描述如何准备一份简单的意大利面条。,你家里来了客人，你想做一顿简单的意大利面，因为时间紧张。你手头只有细面条、西红柿酱和一些配料。
列出至少五个以上的穿着场合，可以穿着蓝色卫衣。,如果我今天想穿蓝色卫衣，你能为我提供一些合适的穿着场合吗？
将以下列出的单词按照字母顺序分别排列。,"mountain, system, classic, maximum, happy, brainstorm, courage, amazing, puzzle"
请创建一份详细的会议议程，确定本周五下午的会议流程。,"会议时间：本周五下午
会议地点：xxxx
参会人员：xxx、xxx、xxx"
编写一个用于预测股票市场表现的算法。你可以使用历史数据和技术指标，如平均线和移动平均线、平均真实范围（ATR）等。,
在下列字符串中找到所有的姓氏：[字符串],字符串：在今天的会议上，Mike Johnson、John Smith和Jennifer Lee都发表了重要的演讲，深受听众的好评。
"对这个列表进行排序：[2, 5, 3, 8, 6, 4, 9, 1, 7]，然后将结果输出。",
将该段落翻译成德语。,今日是个好日子，阳光明媚，万物充满活力。我决定去公园散步。
制定一份推广计划，以帮助一个当地的餐厅吸引更多的顾客。,餐厅：家庭式意大利菜。
根据给定的说明，创建一个图表。,学校内的学生，在不同的科目中获得的分数。
编写一篇800字的社论，就政治人物A最近的声明发表您的观点。,A 最近发表了一篇关于全球变暖的声明，您正在主编一家杂志。
请给我推荐一本小说。,我最近看过的小说：《追风筝的人》
列出以下几项中文网站的英文名称。,百度，淘宝，微信，知乎，优酷
根据给出的事实，写一篇关于该主题的文章。,"事实：
主题：[电子竞技]，人物：[张三]，地点：[深圳]。"
用已知的数据培训GPT模型，让它预测一个秘密值。然后验证它的预测是否与实际值相符。,您拥有50个人的身高和体重数据。使用这些数据来训练GPT模型，并让它预测第51个人的身高和体重。请核实预测的身高和体重是否与实际值相符。
根据给定文本的主题生成一些相关的SEO关键词。,现在有一个网站，他们正在开发一个关于汽车的博客。他们需要一些关键词来帮助他们改善他们的搜索引擎排名。
在上下文中寻找两种不同的解释或解决方案，给出两种不同的方法或措施。,如果您的计算机运行速度变慢，有可能是由于您的硬盘出现了喀嚓喀嚓的声音。这种声音通常表明硬盘正在失去数据，这是非常危险的。
请告诉我一个最新的热门电视剧。,
给出一个关于一部电影的评论。,请评价星际迷航。
给出一组数据，帮助我们预测这个人是否患有糖尿病。,数据集：https://www.kaggle.com/uciml/pima-indians-diabetes-database
请给我列出一些让你感到放松和愉快的方式，当你感到紧张和焦虑时能够使用。,
编辑以下段落，使之更加流畅，句子结构更加复杂。,"原始段落：
我去了海滩。我在那里躺了一个小时。我吸了一支香烟。我沉思了许久。"
请将以下短语表达为一个简洁的单词。,网络日志
在以下句子中找到并替换所有的“与其...不如”成语。,与其每天下班再看电视，不如多学一些新技能。与其因为在家卷铺盖而感到无聊，不如去运动一下。
给我三个适合夏天穿的时尚但实用的衣服品牌。,这个夏天的热度过高，我需要一些适合炎热的天气穿着的衣服。
为我寻找一些优秀的博客，关于机器学习或自然语言处理。,我正在学习数据科学和人工智能方面的知识，我需要一些有信息量和可信度的博客来帮助我的学习。
