instruction_zh,input_zh
请告诉我接下来会发生什么事情。,今天是儿子的生日，他还没有回家。我在等他的电话。
给定一个数据集，构建一个可以预测某个特定事件的模型。,数据集：城市人口数量、平均收入、失业率、犯罪率、当地学校的平均表现等数据。需要预测的事件是某城市是否值得投资。
创建一个12月份的日历表，其中包括所有节假日和生日。,
给出一个适合拍摄的弄脏物品的灰度值。,
告诉我几个可以在家工作的兼职工作选项。,我正在寻找一份可以在家里做的兼职工作，以便可以更好地照顾我的孩子。
请写一篇文章，向人们介绍如何保持健康的生活方式。,
请写一个简要的说明，介绍如何学习一门新技能。,我想学习如何使用一种新的软件，但是我从来没有使用过它。
提供一个完整的、详细的回答来解释机器学习是什么。,
判断以下两个单词是否为近义词。,"请判断""超级""和""非常""是否为近义词。"
解释下列缩写的含义。,CIA，NASA，UNICEF，NATO。
打开天气应用程序并告诉我明天的天气预报。,
"请将以下英文短句翻译成法语。
""I have a dream.""",
为一组文本生成摘要，并对生成的摘要进行评估。,一组新闻文章，需要为每篇文章生成一个摘要，然后对生成的摘要进行评估，以确保它们能够准确地传达文章的主题和要点。
请列出你生活中最崇拜的三个人，并描述他们对你的影响。,
为给定的一段音频文件添加背景音乐。,给定一个3分钟的音频文件，其中是一个人讲述关于旅游的故事。
创建一个随机数生成器，它可以在1到100之间生成一个整数。,
生成一首关于爱的诗歌。,无。
在以下文本中，高亮显示名词短语。,研究表明，锻炼脑力比锻炼身体更重要。如果你每天都锻炼，你的大脑会更加清晰，而且你会更有创造力。
告诉我有关如何在家里养宠物的一些事情。,我正在考虑养一只小宠物，但是我不确定如何在家里照顾它。
找到我最喜欢的歌手的最新专辑，并将其播放出来。,我最喜欢的歌手是泰勒·斯威夫特。
请列出您认为对世界最有益的10项科技发明。,
根据下列指示，编辑一篇文章。,"这是一篇有关体育赛事的文章。原文中有许多语法和拼写错误，你需要对其进行编辑，以使文章更为流畅。

原文如下：

The Game of Thrones is an amazing television show. It takes place in a fantastical world, where dragons and other magical creatures exists. The should is characterized by unexpected plot twists and strong characters, especially the dynamic female protagonist."
"将这句话翻译成西班牙语。
""我想学习西班牙语，因为我计划在明年去旅行。""",
生成一封邮件，询问客户是否对我们的服务感到满意。邮件应该简短明了，但表达出我们的关注和对服务的完美追求。,
给定一个关键词，在Google Scholar上搜索相关的前10篇论文，并从这些论文中生成一篇综述文章。,这个文本写给一个学术研究者，他需要对某个特定领域的文献进行综述。
找到一篇关于未来智能家居发展趋势的文章，并总结其中的主要观点。,
为一本小说写一份书评。,你最近读了一本你认为很棒的小说，需要为它写一篇书评，向其他读者介绍这本书。
给出一段文章，让GPT模型从中提取最重要的关键字或短语。,文章：尽管新冠肺炎疫情对全球经济造成了严重影响，但最近公布的数据显示，在房地产市场方面，越来越多的国家正在迎来复苏。
用社交网络的聊天记录训练一个智能聊天机器人。,你需要系统地分析此前收集的聊天记录，并确定机器人如何对用户进行响应。
请写一段简短的说明，说明什么是雪茄。,
对下列影片进行分类。,请将以下影片分类：《泰坦尼克号》、《请以你的名字呼唤我》、《白雪公主和七个小矮人》、《乱世佳人》和《星际穿越》。
请告诉我昨天发生的三个新闻故事。,
"解释何为""逆向工程""？",
把这个段落的三个主要点列出来。,纽约市是美国最大的城市之一，也是一个世界上最温暖、最鼓舞人心的城市。它拥有世界上最好的博物馆、图书馆和广场，以及一些知名的建筑如自由女神像、帝国大厦和洛克菲勒中心。此外，纽约市还是一个多元文化的城市，你可以在那里品尝到来自世界各地的美食，并体验到各种的艺术形式。
在下面的句子中，找出第一个动词和它的时态。,"Emma has never been to Paris before, but she is planning to go there next summer."
"将下列句子的语法修改为正确的形式： ""我放了我的钥匙在桌子上""。",
请编写一篇关于全球变暖的1页报告。,
为指定的问题设计一个解决方案。,如何保护绵羊免受狼的攻击？
使用从给定文本中提取出的单词创建一个新的句子。,文本：她的心灵深处里有一股坚不可摧的力量。
将以下两句话合并成一句话。,"1. 我们的公司正在推出一项新的产品。
2. 它将改变市场的规则。"
将给定的一段文字转化为它的反义词。,"""今天是阳光明媚的日子，一切都那么美好。"""
请根据以下條件列出文章標題。,"内容需要圍繞著旅遊相關的主題。
-50字左右的關鍵字；
-包含“必看”和“攻略”兩個詞；
-標題應能吸引讀者；"
为这个主题提供5个关于自然语言处理的相关话题。,主题：人工智能
对以下图像进行分类，识别出图片中的物品。,图片：（提供一张图片）
请告诉我10年后的今天是几月几日。,
列出以下名人的出生顺序。,拜伦和雪莉是两位著名的诗人，达芬奇和米开朗基罗是两位著名的艺术家。
以五个步骤列出如何学习一门新的技能。,
找到这本书的出版日期和作者信息。,正在读一本关于自然历史的书。
请写出下一条只有短信长度的微博消息。,
"将这个句子中的单词用“*”替换，但最后一个单词保持不变。输出结果。
句子：“The quick brown fox jumps over the lazy dog”",
列出至少三种可持续的食品来源。,
根据所提供的要求，为一篇科技文献进行排版。,以下是一份未排版过的科技研究文献。
请告诉我以下数字的罗马数字形式。,数字：827、463、2065、99。
对给定的一组文本进行文本聚类，将类似的文本放在同一组中。,一组文本，包括新闻文章、社交媒体帖子和电子邮件，需要将它们聚类，以便相似的文本可以放在同一组中。
将这个开源项目的代码重构，以解决一系列性能问题。,开源项目: https://github.com/spring-projects/spring-boot
"对于给定的文本，使用命名实体识别模型找到其中提到的所有""人名""。","这是一篇新闻报道，讨论了一名政治家的演讲。你的任务是使用命名实体识别模型找到其中提到的所有""人名""。"
给定两个数，计算它们的乘积。,"数值: 14, 27"
将一段话翻译为英文。,"""这个周末我去了博物馆，看到了许多古代文物和壁画。"""
让GPT模型生成一份实验报告，描述和分析你的实验结果。,你在进行一系列科学实验，需要写一份详细的实验报告。使用GPT模型帮助您描述实验目的、方法、结果和结论。
根据以下关键词：科技、家庭、聚会，写一篇有关在线游戏的文章。,在现代社会中，科技已成为家庭娱乐和社交聚会的主要方式。这就是为什么在线游戏已成为了越来越多人的选择，因为它们可以提供与家人和朋友们一起享受娱乐的机会。
请将这个故事中涉及到的人物列出来。,大萨梅巴瑞迪人民为了迎接剪刀舞节，在当地唯一的音乐学院里选拔了4个优秀的年轻舞者。
生成一篇包含以下关键词的新闻报道。,商业，收购，交易
给用户一些写作启示，来帮助他们构思短篇小说。这些启发可以是单词、短语、表情符号等。选定其中一个启发进行写作，并在不超过300字的限制内完成。,
请描述一下如何煮方便面。,
请列举并解释三种常见的英语时态形式。,
请将以下文章的语言更改为正式的语气。,我想在吃晚饭之前先去看一场电影，这很重要。
对于给定的文本，将每个句子归类为“陈述句”、“疑问句”或“感叹句”。,"1. 今天天气晴朗，阳光明媚。
2. 你昨晚睡得好吗？
3. 哇，这张照片真漂亮。"
请编辑以下文章，使其更符合标准语言。,"""我在上周的旅行中见到一个很好的人。他告诉我他正在学习中文，并向我展示了他的笔记本。"""
将一篇文学作品翻译成你的母语。,你正在为一本文学杂志工作，需要翻译一篇法语文章。请将其翻译成你的母语，并尽可能地保持原作的语境和风格。
根据确定的奖项比例，随机选择获奖者。,"您需要从以下名单中选择五人获奖，其中三名获得一等奖、一名获得二等奖、一名获得三等奖：
A、B、C、D、E、F、G、H、I、J"
"请按字母顺序排列以下单词并删除重复项: apple, banana, carrot, banana, carrot, apple, apple。",
描述一个你拥有的技能和经验，可用于执行特定任务。,请描述一项技能或经验，该技能或经验可帮助您完成某项需求。请包括能力描述和实际应用场景。
请根据给定的日期范围筛选出在此时间段内发布的文章。,"起始日期: 2022年1月1日
结束日期: 2022年5月31日"
给定一组人名，请以字母顺序对它们进行排序。,"""杰克""，""安迪""，""约翰""，""苏珊""，""比尔""，""艾米丽"""
用一个逗号分隔的列表对给定的元素进行排序。,"apple, orange, banana, pear, peach"
阅读一篇关于人工智能的科学新闻报道，并简要概述其主要内容及其影响。,
给定一个单词，GPT应该输出一个句子并将该单词随机插入到句子中。,单词：犬。
对于给定的单词，使用词嵌入模型查找它的相似单词。,"这是一个单词""苹果""。你的任务是使用词嵌入模型查找与之相似的单词。"
更新我的日历，以便在本周约见玛丽亚。,"地点：上海。
时间：下周。"
请写出一个可以防止抑郁症的建议。,我有一个朋友，最近感到很沮丧，我想给他一些有用的建议。
"分析以下这段文本中，""美国""一词在不同上下文中的含义。",这个学术论文探讨了美国历史上的一些重要事件，如独立战争、内战和第一次世界大战。
请生成一段有关当前热门新闻的简短报道。,想要了解最近的热门事件和新闻动态。
生成一条有关天气的问句。,无。
请写一堆有关自然灾害的单词，并将它们分类。,
给定两个句子，请使用GPT模型进行比较，并提出它们之间的相似之处或差异之处。,"第一句：我很享受散步在城市公园里。
第二句：我非常喜欢在森林中散步。"
请列出你认为是当前市场上最受欢迎的前五个品牌。,你最近开始研究手表品牌，并想了解目前市场上最受欢迎的品牌。
给定一篇文章，根据其中的描述，回答一些具有挑战性的问题。,"主题：疫苗
文章：一项最新研究发现，疫苗的有效时间可能比原来预计的要短。这项研究是在对三种主要新冠疫苗进行全球大规模跟踪研究后得出的结论。虽然数据显示，疫苗的保护时间不如预期长久，但专家仍然认为疫苗对控制疫情至关重要。此外，研究结果还显示疫苗接种后产生的免疫反应可能会逐渐减弱。这意味着在疫苗有效期结束后，需要进行适当的接种和免疫接种计划。

问题1：最新研究发现什么问题?
问题2：有效时间短的发现是基于什么上进行的?
问题3：疫苗保护的时间有多长?
问题4：此项研究的结论对于控制疫情是至关重要的原因是什么？
问题5：疫苗接种后会发生什么？"
请找到一首流行歌曲的歌词，并判断它是否含有粗鲁语言。,你是一个父母，想要让孩子听一首非常受欢迎的歌曲，但不希望歌曲中有不当的语言使用。
推荐一款新电影，该电影类似于这个列表中的另一个电影。,已经看过的电影：《肖申克的救赎》、《阿甘正传》、《当幸福来敲门》、《楚门的世界》。
查找一项历史事件并描述它。,你想了解有关美国独立战争的信息。
在给定的文本中，找到含有“猫”和“狗”两个词的句子，并输出该句子。,猫咪和狗狗是最常见的宠物之一，人们会把它们视为家庭成员。有些人喜欢猫，因为它们独立性强，而且不需要太多的关注。其他人喜欢狗，因为它们通常更亲近人类，而且可以成为很好的守卫者。然而，有些人同时拥有猫和狗，他们认为这两种动物都有自己的优点和缺点。所以，你喜欢什么呢，猫猫还是狗狗？
请给出一个现代音乐家或乐队的名字并介绍一下他们的音乐风格。,
为这篇文章写一个标题。文章讨论了新冠疫苗的安全性。,这篇文章讨论了新冠疫苗在全球范围内的接种情况以及其安全性。
请为以下三个事件赋予分类。,"1. 听到别人讲他们失业了。
2. 睡眠扰动。
3. 看见一只可爱的小猫。"
将输入的图片转换为黑白照片。,无。
绘制一个由红、蓝、黄三个颜色的圆形徽标设计。,你需要为你的新创业公司设计一个徽标。
请根据以下图片，对所见物体进行描述。,附件：一张画着一只狗的图片。
为一个事件创建一个广告口号。,这是一个关于新版手机的广告。你需要创造一个高效而又能吸引人的口号，以鼓励人们购买它。
分析以下两家公司的财务报表并比较它们的表现：苹果公司和三星电子公司。,提供公开的财务报表。
从以下图像中识别出中间的基本形状。,图像见附件。
计算出这组数据的中位数。,"数据：
{1, 3, 5, 7, 9, 11, 13}"
给定一篇新闻文章，将其简化为200个字符的概述。,新闻文章：中国宣布建造世界上最长的跨海桥梁，连接福建和台湾。这项工程将改善两地经济紧密联系的事实，是两岸交通网络发展的伟大成就。
将给定的二进制串转换成其对应的十进制数。,101101
找到一个最近2年内发布的与环境保护相关的报告。,我正在为一个环保组织工作，需要这份报告来引用其中的数据。
找到所有在2021年出现在新闻标题中的人名和组织名。,在2021年，环球时报报道了许多事件，比如推特社交网络关闭了前美国总统的账户，或者是新冠疫情在全球范围内的流行。请从这些新闻标题中找出所有的人名和组织名。
列出五个你最喜欢的歌手或乐队并解释原因。,
给出一个有意思的事实。,无。
对于给定的文档，从中提取出所有名词词组。,"这是一篇来自 CNN 的新闻报道。
标题：美国军方领导人：俄罗斯正在从叙利亚撤军，美军仍在继续行动
正文：美国国防部长马蒂斯（James Mattis）周五告诉记者，俄罗斯已经开始从叙利亚撤军，而美国军队仍继续执行任务，并且目前无计划撤出。"
给出两个年份，计算它们之间的年份数量。,"年份：1999, 2019"
请阅读下列短文，并从下列选项中选择最好的标题：,"在一个繁忙的办公室里，亚历克斯小心翼翼地捡起他的笔记本电脑，小心翼翼地将其放在一旁的桌子上，以便将屏幕转向另一个角度。正当他认为他完成了他的工作时，他外面突然传来了一个巨大的声音，吓得他整个人都跳了起来。他的同事们开心地嘲笑他，因为他没能意识到一只鸟在窗户外撞了一下。

A. 易碎的笔记本电脑
B. 办公室的环境
C. 鸟类危害生产力
D. 工作中的幽默感"
请为一个新的应用程序设计一份用户手册，包括使用说明和安装说明。,应用程序：一个管家应用程序，可以帮助用户组织他们的日常任务和时间表。
请将下面的动物以其科学名称的字母顺序排序。,"goldfish, lion, dog, elephant, cat, gorilla, antelope"
请告诉我三个最高的建筑物。,
给我15张山水画的图片，并用一两句话介绍每张画的特点。,我正在为我的艺术课程做作业，需要调查一些山水画。我已经找到了一些比较有名的画家的作品，现在我需要找到一些图片，以便我可以更深入地了解不同类型的山水画。
使用以下空格填写句子以确保其合理：_____ 分针和 _____ 秒针指在12点。,
分析一份社交媒体数据集，找出其中的关键词和热门话题。,数据集：Twitter 数据集。
根据图片描述物品。,请描述这张图片中的物品。
请告诉我生活中如何实现节约能源？,
向研究生们介绍一道数学难题，要求他们解决这个问题。,你是一名教授，正在给学生们讲授一门高级数学课程。你需要向他们介绍一道数学难题，以便让他们应用自己的知识来解决这个问题。
请为我列出我需要在出门旅行时携带的物品清单。,我将在明天早上前往迈阿密度假。
根据下列指示，编辑一个段落。,"这是一段有关体育赛事的段落。你需要编辑它，使之更为流畅，并确保段落中没有任何语法或拼写错误。

原文如下：

他们的队伍很有牵连力。尽管如此，他们最后却输了比赛，而这吓坏了他们。"
请使用以下关键字在互联网上查找一家意大利餐厅: 意大利 奶酪 披萨。,
根据一组给定的数据，绘制一个柱状图。,"数据：
- 1月份销售额：$5000
- 2月份销售额：$6000
- 3月份销售额：$7500
- 4月份销售额：$9000
- 5月份销售额：$10000"
这家餐厅是什么类型的餐厅？请提供相关证据。,"墨尔本：“Viva 麦墨
Viva 麦墨向客人提供美味日本健康食品。我们在墨尔本的多个位置设有分店，以提供最好的日本美食。我们的菜单包括日式咖喱、冷面、天妇罗和炸豆腐。"
为给定的论文编写一个概括。,"这是一篇计算机科学领域的论文，题目是：""使用卷积神经网络对图像进行分类的新方法""。"
请从以下城市列表中，选择三个你认为最适合旅行的城市: 东京、纽约、伦敦、巴黎、墨西哥城、悉尼。,
告诉我一些关于巴西的有趣事实。,
使用Python编写程序，将所有重复的行从文本文件中删除。,在一个文本文件中，有多个重复的行。需要编写一个程序，将这些重复的行删除并保存文件。
根据所给的情况描述一个人。,"请根据下面所给的背景描述一个虚构的人物：
这个人是一个年轻的律师，是一位出色的演讲家和写手。他经常为那些受到不公正对待的人辩护。他有一个无与伦比的天赋，能够让任何人都理解法律。"
请将这篇文章分成不少于5段。,人类的历史，是一部奋斗之史。几乎每个时代，每个民族，每个个人都经历过种种苦难，而且在度过苦难之后才会进一步的发展。因此，我们不应该认为自己是这样或那样的宠儿，应该意识到我们的共性，更加积极主动地去面对人生。不管我们所处的是黑夜还是白天，不管我们身处的是真空还是有空气的地方，我们都需要时刻警惕自己，自我加压，进而在大自然中追寻我们所追求的幸福和自由。
根据以下约束条件，为一个大小为10的非负整数数组随机生成10个数字。,约束条件：数字不能超过150，所有数字必须不同，数组总和不能超过1000。
使用指定的文本分类器，将给定的文本数据集进行分类。您应该使用一种适合该数据集的分类器。,"""这个数据集由2000篇电影评论组成，分为两个类别：积极和消极。请使用朴素贝叶斯分类器对这些评论进行分析。"""
将以下水果按照名称顺序分类并分别写在不同的列表中：香蕉、苹果、橙子、葡萄。,
根据以下关键词，描绘交通状况。,城市中的交通流量变化很大，时不时地需要重新规划路线或者采用更好的交通方式来提高效率。现在，我们要根据以下关键词来描述当前的交通状况。关键词包括：私家车、地铁、公交车、交通拥堵、绿色出行。
修改一段英语文本，使其更符合受众需求。,提供一篇已撰写好的英语文本，需要修改它以更贴合目标读者的需求。
给定一组数值数据，并计算出其平均值、中位数和标准差。,"以下是一组数据，表示某公司上个月每天的销售额（以美元为单位）：50, 75, 120, 90, 110, 100, 85, 95, 105, 80。"
写下一个短故事或小笑话，以此来娱乐我。,请给我讲一个幽默的故事或一个有趣的笑话，让我愉快地度过一段时间。
给一份文本分类，例如将一份长文本分为多个章节。,文本：某篇小说。
在以下清单中选择五件你最想拥有的物品或体验。,请看以下物品或体验列表：
根据以下指导，生成一篇500字的文章。,指导: 写一篇介绍2020年奥运会最令人印象深刻的时刻的文章。文章的题目为“2020年奥运会：最难忘的时刻”。
"根据以下指令创建一个计算器应用程序：
1.用户输入数字和操作符
2.计算机输出结果",
统计给定文本中每个单词出现的次数，并按照字母顺序以逗号分隔的方式输出。,"文本：""计算机科学是一门信息科学，它研究计算机及其应用。"""
将一个长度为10的字符串中的所有元音字母替换成数字2。输出替换后的字符串。,"字符串：""The quick brown fox jumps over the lazy dog"""
在您认为书籍、电影和电视节目中最喜欢的类型之间进行排序。,
编写一个100字以内的科幻小说，以“宇宙旅行”为背景。,
生成一篇500字的随机文章。,
"""你认为一个人应该怎样才能变得更加健康？""",
给我列出5个不同的动物名字，它们的名字以字母“A”开头，但第二个字母不相同。按照字母顺序排列，并输出结果。,
根据这篇文章中的信息，编写一个关于AI技术的总结。,摘要：人工智能正在慢慢地走向成熟，已经进入了商业应用，并为人们的生活带来了很多变化。虽然这项技术存在潜在的风险，但从长远看，它有望改善我们的生活，推动我们向更加智慧化的未来迈进。
从给定的选项中选择最适合完成下面句子的单词。,"""昨天我要了一杯______，而不是咖啡。""

- 茶
- 奶茶
- 果汁
- 冰水"
生成一个描述虚构人物的人物表格。,虚构人物：一名古怪的侦探，有癖好，热爱收集错版邮票。
请给我推荐一份适合在家工作的电脑配置清单，可以满足日常办公和轻度游戏需要。,我最近需要购买一台新的电脑，但我不是很了解各种硬件的性能和价格，希望可以得到一些专业的建议。
"请运用以下词汇，写一篇关于健康生活的建议。
词汇：均衡饮食、适度运动、规律作息、心理健康",
请生成一篇具有流畅语言、逻辑性强且有趣的文章，主题为探索海底信使RNA在生命起源和进化中的作用。,
根据给定的房产要求，为客户推荐一套房子。,"""客户想要一套三室两厅的房子，至少有120平方米，位置在市中心，预算在500万以内。"""
使用一个网络爬虫程序，从在线新闻网站上爬取所有关于科技的文章。,新闻网站：新浪科技。
制作一份详细的旅行路线规划，包括景点、交通和住宿安排。,希望在一个国家旅行，需要规划行程，安排交通和住宿，并确定要游览的景点。
根据以下要求编辑文档：,将文档中的所有第二人称代词更改为第三人称代词。
根据所提供的背景材料，编辑一篇关于健康饮食的文章。,以下是来自一家 health nutrition 网站的数据和文章草稿。
为以下描述的人物编写一份建议信。,这个人想要申请一份高薪工作，但他没有相关的经验和技能。
从图像中提取所有的人脸，并标记每个人脸的位置。,图片：一张集体照片。
帮我列出10个可以在家中没有器材的健身动作。,
提供一句英语，让 GPT 模型产生能表达该句意思的中文句子。,你的老师要求你将英文句子翻译成中文。
将下面的单词翻译成德语。,"""苹果""、""橙子""、""香蕉""、""草莓"""
给定一段英文文本，请将原文翻译成中文。,"原文：I have a dream that my four little children will one day live in a nation where they will not be judged by the color of their skin, but by the content of their character."
给我一句你能想到的最好的关于时间的议论。,
使用Python编写程序，在控制台中打印完整的文件夹路径。,在一个文件夹中有多个子文件夹，需要编写一个程序，在控制台中打印任何一个子文件夹的完整路径。
将下列句子翻译成相应语言。,英文：I love you.
描述一个喜欢摇滚乐的成年人可能会拥有的特定品味。,
