instruction_zh,input_zh
对于给定的文本和相应的翻译（或多个翻译），使用文本优化模型生成更符合语言规范和上下文的翻译。,这是一篇长篇小说的章节，已被翻译成不同语言。你的任务是使用文本优化模型生成更符合语言规范和上下文的翻译。
使用深度学习框架训练一个图像分类模型，用于区分一些手写数字图像。,数据集：MNIST。
对于一个包含杂音的音频文件，使用自动语音识别模型将其转换成文本。,这是一段包含大量杂音的语音记录，是从一个非常嘈杂的机器中捕获的。你的任务是使用自动语音识别模型将其转换成文本。
"请翻译以下句子： ""你好，很高兴见到你。""",
请将下列句子转换为单数形式。,来自不同国家的旅客在这家旅店住宿。
将以下描述的文本段落转换为陈述句。,你是否每天早上都感到特别疲劳？是否感觉精力不足，导致无法有效地完成任务？
利用已有的源码并结合新的特性，修改一个Python应用程序。,应用程序是一个简化版的在线购物商城，你需要在其中添加一个新的支付方法。
根据下列条件为给定的数据框创建一个筛选器。,"数据框中的""Age""一列包含值从0到100之间的整数。筛选器应该只显示年龄在25到40之间的人。"
用最少的单词来描述自己,
输出一首适合夜晚放松的音乐。,无。
给定一篇文章，尝试根据其中的背景和结论判断文章的旨意。,"主题：工业用途的机器人
文章：最近，一批行业内人士发起了一项名为“非接触式”自动化的计划，这项计划旨在推进制造业内更优秀、更快速和更适应性强的机器人。该计划的最大愿景是为工业领域提供更多合适的机器人技术，实现生产现场的自动化，并提高工作效率。许多人指出，机器人技术将取代传统工业，成为生产线上的主力。"
重排一个给定数列，使排序规则为每个数字的它的整数部分的平方。,"数列：3, 2.5, 1.1, 6.8, 1.2, 5.5, 8.9, 6.7。"
请给出三个可以帮助提高工作效率的建议。,您是一名白领职员，经常需要处理文件和电子邮件。
根据一个给定的单词，写一首包含这个单词的简短诗歌。,单词：自由。
"使用Python编写程序，将所有图片文件复制到名为""pictures""的文件夹中。","在一个文件夹中，有多个图片文件。需要编写一个程序，将这些图片文件复制到名为""pictures""的文件夹中。"
列出3所世界上著名的大学。,
给出一个简短的自我介绍，包括你的职业、教育背景等基本信息。,一位招聘经理要求求职者进行自我介绍。
编写一组简明的指南，以协助用户更好地搜索您的公司网站，以及找到他们需要的资料。,您的公司的网站较为复杂，很多用户反馈难以找到他们需要的资料。您需要编写一组简明的指南，帮助用户更好地搜索您的公司网站，以及找到他们需要的资料。
请在以下列表中，为我挑选出预算在50美元以下的3家餐厅。,"咖喱屋（Curry House）（60美元）
Pomodoro's（75美元）
观日轩的餐厅（50美元）
Estrella（90美元）
夏洛特（45美元）"
请描述一下如何在Google Docs中创建一个新的文档。,
请给出三个能够影响人类寿命的因素。,
给以下数字排个序。,"5, 2, 7, 8, 1, 6"
请为一个新的产品编写一份广告宣传词，并提供详细的市场定位。,一个全新的游戏机。
任选一个主题，给出一份包括20个问题的问卷。,您需要任选一个主题（例如，婚姻、育儿、人际关系、健康等），并为该主题编写一份包括20个问题的问卷。
准备一个中文歌单，包含您最喜欢的五首歌曲。,
根据给定的列表，找出最适合的项目并输出其名称。,"项目列表：
- 开发一款新的社交媒体应用程序
- 建立一个在线论坛
- 安排一个电子邮件营销活动
- 打造一个新的博客"
请写一篇关于瑜伽学习的短文，包括对瑜伽的描述以及三个建议。,
为一张照片配上恰当的音乐。,这是一张野外战士在树林中行走的照片。
根据输入的一段文本，将其翻译成另一种语言。,文本：外星人来到地球，他们对人类文化产生了极大的兴趣。
描述如何组成一个好的开头段落。,你正在写一篇文章，需要吸引读者的兴趣。
用正确的语法编写一个关于人类对生态的影响的短文。,
根据一组指标，将国家分为发达国家和发展中国家。,给定的指标：人均GDP、人均寿命、素质教育水平。
在以下给出的文本中提取出关键词和短语。,“这座城市有着奇怪的天气，我们必须去商店买伞。而商店的位置已经在早上的邮件中给你发过了。”
根据以下内容，对文章进行简要摘要。,"""这篇文章讨论了全球旅游业的现状和未来趋势。旅游业是全球最大的行业之一，预计到2025年，它将占全球GDP的10%。 然而，随着全球化的深入发展，旅游业也面临着许多挑战，如气候变化和大流行病的影响。"""
请在Python中编写一个函数，该函数接受两个参数并返回它们的和。,"示例参数分别为5, 7。"
根据所提供的指示，检索特定的网页。,"请在搜索引擎中输入关键词""小说在线阅读""，然后从搜索结果中选择第一项。"
将所有偶数与奇数的数字分为两组。偶数数字应该放在一组中，奇数数字应该放在另一组中。请写出这两组中数字的总和。,"12, 4, 7, 15, 16, 13, 2, 9, 8, 6, 11, 5, 3"
生成一篇关于某个历史事件的文章。,历史事件：美国独立战争。
用Python创建一个简单的股票价格跟踪器。,您正在关注您最喜欢的公司的股价。
给定一个电影或电视节目的名字，输出该节目的IMDb评分。,电影或电视节目：《权力的游戏》
找到一篇有关全球变暖的研究文章。,我要写一篇研究文章，我选择的主题是全球变暖。你能帮我找到一篇有关此主题的研究文章吗？
根据以下信息计算图书馆书籍借阅的数量变化。,过去一年，每个月有5000本书被借阅。最近一个月有6500本书被借阅。
请生成一串随机字符串，包含大写字母和数字，并且长度为10。,
将一段文本翻译成中文。,"文本：""The quick brown fox jumps over the lazy dog."""
寻找一些房屋出租信息。列表示图像和地址。,
根据某个指定的主题，写一个短篇故事（不少于200字）。,主题：爱情
请给出三个可以激发团队建设的建议。,我正在组织一个小团队，我想知道如何激发成员的积极性。
列出你最喜欢的5种冰激凌口味。,
输出给定日期的星期几。,2022年5月11日
按照数字大小排列下列电影从新到旧。,"1. 阿凡达
2. 教父
3. 泰坦尼克号
4. 星球大战"
写下具有5个元音字母的5个单词，它们没有重复的字母。,
"编写一个程序，将所有文件名后缀名改为""txt""。","在一个文件夹中，有多个文件的后缀名不是""txt""。需要编写一个程序，将所有文件的后缀名改为""txt""。"
在给定的电影标题中提取出电影年份。,电影标题：[泰坦尼克号]。
根据给定的词语，写一个由恶意推动的新闻标题。,词语：巨额罚款
请为下面的图片画一张草图。,无。
请问有哪些措施能帮助减少对环境的污染？,
使用昨天的机器学习实验数据，实现并测试单个运算符的性能。,在您的实验中，您测试了两个不同的运算符-softmax和relu。
请编辑以下段落，使其不再重复使用同一词汇。,尽管他一开始很紧张，但他很快就变得十分自信，因为他知道自己已经准备好了。他脚下的地面很滑，但他还是站稳了。他没有退缩，而是继续朝前走，并最终成功了。
编写一个网络爬虫，从Google搜索结果中提取指定网站的链接。,您需要设计一个工具，可以定期监测竞争对手的网站，并收集新发布的文章。
构建一个简单的回归模型，用于预测住房价格。,你是一家不动产公司的成员，你需要构建一个模型，以预测房价。
列举三种不同类型的食品，它们有助于提高心理健康。,
提取该文件中所有人的名字。,《红楼梦》之人物姓名列表
将以下商品列表按价格升序排序。,您的公司有一个关于您的客户购买数据的报告。它包含了各种产品的销售数量和相应时间段的价格。您需要向您的老板展示当前排名前10的产品并按照价格升序排序。
生成一组包含一定数量的随机数，并计算它们的平均值。,
生成关于给定主题的五个问题。,环保
解释什么是全球变暖，以及人类对其影响的原因。,全球变暖是指地球表面温度的增加。这种现象通常被认为是由于人类活动导致的。
描述一种新的虚拟交互体验，它可以改变人们的日常生活。,
为一个特定的场所推荐一个旅游路线。,推荐一个旅游路线，让游客在纽约市一天内游览尽量多的景点。
将以下文本中的所有错别字和语法错误进行纠正。,我 bu 会 xiang yin yong zhong wen。Wo wei wu suo suo zhi，jue bu zhi dao zen me shuo hua。
为一本书封面设计一份简单的封面。,您需要为一本书设计一份简单的封面，包括书名、作者和封面图片。您需要考虑目标读者和书籍内容，确保封面吸引眼球且吸引人。
为一份简历写一篇自我简介。,你正在找寻新的工作，并需要为自己的简历写一篇自我简介。请尽可能地突出你的技能、经验和成就。
生成一篇新闻文章，关于当地政府修建了一个新公园，并介绍公园中的特点。,几个月前，市政府宣布修建一个新公园，以便居民们有一个放松身心的地方。去月初，公园终于开放了。
为这个文本生成一个摘要。,"文本：
""自然语言处理是一门涉及人与计算机交互的科学。它涵盖了自然语言生成、机器翻译、语音识别和文本分析等诸多领域。"""
请编写一篇博客文章，讲解以下话题，并为你的文章命一个标题：,"- 你倾向于拥护但又无法解释的思想体系是什么？
- 结合你最喜爱的电影、书籍、音乐，解释这种思想体系如何影响了你。"
为输入的文本生成下一句话。,“生命中最重要的事情是什么？”[玛丽]问。[汤姆]沉思了一会儿，给出了答案：“幸福。”
创建一个词云，其中包括给定文本中最常见的单词。,文本是一篇有关人工智能和未来发展的文章。
对下面的三个数字进行排序：28、93、47。,
重新排列这些单词，以形成一句有意义的话。这些单词是:“咖啡馆”、“吸毒者”、“卡车司机”、“赢得”,我需要您将这些单词重新排序，以形成一句有意义的话。我想解决这个难题，但是我自己想了很久都没有找到正确的答案。
对以下句子进行语法纠正。,将接收员工披露申诉的程序告知所有雇员。
分析给定数据集，以确定某一产品/服务实现成功的关键因素，并编写一份报告披露这些发现。,您的公司在推出了一项新的软件服务后，发现该服务并未得到客户的大力支持。您负责对此进行分析，以确定造成失败的原因并提供改进建议。您可以使用公司内部数据库中的数据，以及最新的市场分析数据。
请在GitHub上创建一个新的存储库，并将下面的代码上传到存储库中。,"```python
print(""Hello, World!"")
```"
将给定的邮件分类为垃圾邮件或非垃圾邮件。,"邮件文本:

""您好，您的账户已被锁定，需要您前往以下链接进行解锁。"""
根据一个主题，为一个品牌开发一则广告口号。,主题：“停车位紧张”
请为一个寒冷的冬夜设计一款温馨的家居场景。,无。
给出一个包含五个数字的列表，并编写一个程序，找到其中的最大值。,"[2, 8, 14, 5, 10]。"
根据故事情节，回答以下问题。,一只海龟踩着毒蛇向终点前进，在半路上遇到了一只飞鱼。
将以下句子翻译成西班牙语。,"""请问，洗手间在哪里？"""
创建一份包含食材和厨具清单的“意大利披萨”菜谱。,
为一个正在进行的项目创建一个待办事项列表。,请列出至少三个待办事项，以完成一个正在进行的项目。
请列出3个世界上最大的科技展览会的名字。,
创建一个新的文件夹，将所选文件移动到该文件夹中。,"我们有一个名为""documents""的文件夹，您刚刚下载了新的文件，并且现在想将它们移动到新创建的名为""new_folder""的文件夹中。"
给我推荐一本关于历史的书籍。,我对历史十分感兴趣，但我之前没有读过太多关于历史的书籍。我想找到一本好的书籍来增加我的知识。
根据给定的要求，设计一个网页。,我正在为我自己的企业设计一个网站，我想它既能让人感到专业又能吸引人的眼球。
生成一份建议书，内容为建立一个海滩酒店。,你是一家酒店开发公司的一员，你需要为你们的管理层生成一份新酒店的建议书。
给出您最喜欢的三个旅游目的地。,
将下列两个数字相加： 29345 和 58493。,
编辑给定的电子邮件，并确保它的语法正确。,邮件正文：尊敬的客户，你最近的订单已经成功配送。如果你有什么问题或需要帮助，请随时联系我们的客户服务部门。感谢您的购买和支持。
请用4个单词或更少的单词描述投篮。,
为给出的数据集选择一个合适的机器学习算法，并且从中生成一个分类器。,数据集包含来自医院的三个不同应用领域的数据。数据集中的每个实例包含诊断信息、药物治疗（如果有）和基因序列特征。
查找马可波罗游记的作者和书写时间。,
找到下列三个单词的同义词。,"大: __________
忙: __________
富有: __________"
"请按作者排序，列出以下三本书的书名: ""简·奥斯汀的傲慢与偏见""，""哈珀·李的杀死一只知更鸟""和 ""约瑟夫·康拉德的黑暗的心灵""。",
给定一个日期和一个城市，请提供以下天气预报。,2022年11月25日，伦敦。
请将下列短语分类。,"短语列表：""太阳"", ""月亮"", ""火星"", ""金星"", ""露天影院"", ""科学博物馆"", ""天文学"", ""宇宙飞船"""
编写一个短的电子邮件提醒，告诉所有员工时间安排上的变化。在邮件中提供详细的信息，以确保员工能准时参加每项任务。,您计划调整一些关键任务的时间表，以使它们更加高效。为了确保您的团队始终准时参加每项任务，您需要发送一封电子邮件提醒，并在邮件中提供详细信息，这样他们就能进行适当的调整。
请分析并比较两种流行的数据库技术，MongoDB和Cassandra。,您是一名数据库管理员，正在考虑MongoDB和Cassandra中的哪一个更适合您的项目。您需要让GPT模型对这两种数据库技术进行详细的分析和比较，以便您可以做出明智的决策。
根据给定的数据创建一个表格。,数据：某医院的患者就诊记录
在以下文本中找出所有动词的过去式形式。,在昨天的会议上，我们讨论了公司的未来计划，包括拓展我们的市场份额，提高客户满意度，加强的产品创新，增加市场营销活动，在社交媒体上宣传我们的品牌，重视员工培训和发展。我们还决定要增加客户服务部门的服务水平，以提高客户满意度。
请描述一下你最难忘的旅行经历。,
在已有资料的基础上，为某个产品或服务编写介绍文案。,某个品牌的新手机
基于文本语料库，给出一个关键词的同义词。,"请给出单词 ""slow"" 的同义词。"
给定一个数列，请找到其中最大的数字并输出。,数字列表：5，17，8，23，12，6。
帮助我准备下一场金融面试。,
提供一组500个以上的英语单词，这些单词在牛津词典中都有定义。,
根据您对自然的了解和对生态学的知识，说明为什么自然的多样性对人类和地球生态系统的重要性。,
翻译这篇文章并确保完整性。,文章：追求梦想并不是一帆风顺的过程。它需要耐心、毅力和成就。这也意味着遇到挫折时不要轻易放弃，而是奋斗到底，坚定不移。
这篇文章中有多少个段落？,针灸是一种传统中医技术，使用非常细的针缎刺穿人体的肌肉和组织。这可能听起来有些可怕，但是这种技术已经在中国使用了超过2000年，并且在当今的医学中仍然有广泛的应用。针灸可以治疗多种疾病和问题，如头痛、慢性疼痛、失眠、焦虑和消化问题。
输出10个人的年龄和性别的随机列表，并按其年龄从小到大排序。,"人1：姓名Jason，性别M，年龄25
人2：名称Lisa，性别F，年龄32
人3：名称Bob，性别M，年龄18
人4：名称Mandy，性别F，年龄41
人5：名称Joe，性别M，年龄29
人6：名称Linda，性别F，年龄36
人7：名称Sam，性别M，年龄47
人8：名称Cathy，性别F，年龄24
人9：名称Adam，性别M，年龄31
人10：名称Diane，性别F，年龄23"
请填写以下的空白部分，以便获得正确的意思。,食品{ }是指在储存、加工或制备过程中添加的食品添加剂。
将以下两个句子合并成一个句子，并且使用适当的连词。,"1) 我们需要购买一辆新车。
2) 然而，我们的预算非常有限。"
根据给定的主题创作与之相关的图片。,"主题：""勇敢""。"
根据10月份销售数据为我们的公司预测下一个季度的销售额。假设第四季度营业额的增长率与第三季度的增长率相同。将预测值四舍五入到最接近的百万。,这是我们公司的最新营收数据。我们的Q3总营收为3100万美元，与上一季度增长率相比增长了5%。我们预计在第4季度，增长率将继续保持不变。
编辑一段不符合标准语法和用法的英文文本。,
根据这个主题写一篇短文章：我们如何在数字时代中保护隐私？,在数字时代，我们面临着越来越多的数据泄露和隐私侵犯风险。在这个主题下，写一篇短文章探讨一些保护隐私的方法和措施。
给定一张图片，写出一段描述。,这是一张纽约市标志性的城市景观的照片。它拍摄于曼哈顿区。
"请将下面这个列表按照字母顺序排列。
""apple, banana, cherry, durian, elderberry""",
根据以下指导，为以下实验编写一个简短的摘要。,"指导：摘要应该包含实验的主要目的、方法和发现。

实验: 测量酸性水和碱性水中植物芽的生长情况。"
根据给出的关键词，为指定主题创作一篇短文。主题为：健身。,关于健身，您需要从如下的关键词中选择至少3个，然后为该主题编写一篇至少200字的短文。可选关键词：锻炼、健康、跑步、器械、瑜伽、良好的饮食、提高免疫力、塑身。
根据给定的写作主题，编写一篇文章。,写作主题：如何生活得更加健康
让我听一首轻松的钢琴曲。,现在我很紧张，想听一首轻松的音乐来放松自己。
生成一个5个词的描述餐厅的句子。,
在给定的加密文本中找到所有的常见单词，比如“the”和“and”。,您有一段加密的文本，您需要在其中找到所有的常见单词。请注意，您只需要标识出所有的单词，而不需要将它们解密。
根据以下材料，写一篇报告，报告内容包括这个城市的气候和历史。报告应该包含数据、图片、表格等素材。,这是一个叫做Springfield的城市，在美国中部。它拥有节日活动、体育活动和博物馆，还是家庭旅行的理想之地。
请告诉我美国的首都是哪个城市。,无。
找到并编辑这篇文章中与气候变化相关的内容，并将其标记出来。,阅读这篇文章，了解关于越来越热的夏天带来的影响的信息。
根据以下信息制作一个轻松的晚餐菜单。,您今晚要和好友一起共进晚餐。
给出一个红色五角星的形状，包括五个点和五条线。,
请查找一份关于Python编程的指南，内容应包括Python的基本语法、数据类型和控制结构。,
帮我找到一款适合在家里健身的器械。,你想在家里健身，但不知道该买什么器械。你需要一款适合初学者的，价格合理的器械。你家里有多少空间可以放这款器械？
将以下文本翻译成法语。,“我喜欢在周末早上跑步，这让我感觉身体更健康，也让我精神更加清醒。”
找到一家最近的披萨店。,我很饿，但不确定附近有哪些餐厅。你能帮我找到一个地方吃披萨吗？
给定一段文本，让GPT模型根据上下文生成一个与文本相关的好问题，使得该问题可以引导读者深入理解文本。,文本：在这个世界上，有很多人通过各种方式帮助那些需要帮助的人。从募捐活动到志愿工作，每个人都可以寻找一种方式帮助这些人。
根据以下提示，写下一篇发言稿。,"主题：生命，敬畏和责任。
目标观众：高中学生。
内容：讲解生命的意义，人类对自然界的影响，以及作为生命的拥有者的责任。"
请将以下句子翻译成法语。,"""我每天都会练习说法语，因为我想在未来能够去法国旅游。"""
根据所提供的数据，预测未来一年你的股票投资回报。,过去一年，你的股票投资总收益为1.8万美元。
请评估英语学习的重要性，并提出提高英语能力的建议。,英语是一项重要的全球语言，它是商业、学术、娱乐等领域的标准语言之一。
用给定的素材完成一首歌曲。,素材：鼓的节奏，吉他的和弦，一段歌词
为一个新公司创建一个标志。,公司名称：无边界科技。
请给我介绍一个有趣的课程或者学分研究项目。,你是一名在校学生，想要扩展自己的学习领域。
创建一条短消息，告诉你的合作伙伴你将迟到十五分钟，并道歉。,你在路上要去参加一个很重要的会议，但交通非常拥堵，预计会比原计划晚到十五分钟，需要提前通知你的合作伙伴，并道歉。
根据提供的内容，设计一个完整的网站并添加必要的信息和页面。,内容：一个健身中心的网站，包含健身房设备、班级、指南和加入计划的信息。
"在给定的文本中，找到并替换所有的""旅馆""一词为""酒店""。","我最近在布拉格旅行，住在一家名叫""住多酒店""的旅馆里。虽然住宿条件还不错，但我还是想换一家更好的酒店。"
给我列出十本最畅销的自助书籍。,
描述一个国际货运公司应该考虑的主要战略和业务风险，并解释为什么它们很重要。,您需要向您的团队说服一家国际货运公司采用更加安全和有保障的业务模式去管理他们的风险。您需要准备一篇报告，描述可能的业务风险，并建议他们应该考虑的重要战略。
对给定的文本进行情感分析。,几百个来自社交媒体的帖子，需要对它们进行情感分析，以确定它们是积极的、消极的还是中性的。
创建一个新的 GitHub 存储库，并将本地项目推送到该存储库。,
"请将以下离散数据绘制成折线图并输出结果。坐标轴为横轴X：年份，纵轴Y：销售额。
2015年：80万；2016年：120万；2017年：180万；2018年：200万；2019年：280万。",
列出五个提高工作效率的建议。,需要在家办公
请完整复述下面这个故事。,曾经有一个勤奋努力的士兵，他因为勇气和忠诚被国王任命为他的首席护卫。然而，这名士兵成为了国王的新婚妻子的情人。
给出一个由五个华丽的形容词组成的句子。,
对给定的一段文本做分词处理。,文本：自然语言处理是一个非常有趣且有用的领域。
对于给定的两个数字，计算它们的乘积。,数字：4和3
编写一个算法来预测用户是否会购买某种特定产品。,"给定一个包含10,000个用户的数据集，其中20%的用户购买了该产品。"
请写一个简短的描述，说明当前的天气是晴天、多云还是阴天。,
请以两个以上的例子描述“成为自己的主人”这个词。,
在下列三条语句中选择一条，并介绍其含义。,"(1) 布林函数是对输入变量的逻辑运算结果的函数。
(2) 批归一化是训练深度学习模型时使用的一种技术。
(3) Dropout是在训练神经网络时用于减少过度拟合的一种技术。"
用摄像机记录当前的天气情况，并创建一个天气预报。,你是一名气象学家，需要创建一个新的天气预报。你需要使用摄像机记录天气状况，并编写一个报告，包括当天的温度、降水情况和风向。
请给我一个运动趣味的想法。,你的公司将在下周周四举行一次步行社交活动，你希望能提供一个有趣的活动。
请根据以下图片，描述每张图片中人物的服装和表情。,（插入一组包含几张不同人物和服装的照片的图像）
